<?xml version="1.0" encoding="UTF-8"?>
<!DOCTYPE MMR_FR SYSTEM "mmr_fr.dtd">
<MMR_FR>
  <Entry_ID>OSDPD-L2P-GOES11</Entry_ID>
  <File_Name>20070828-GOES11-OSDPD-L2P-GOES11_North_0000Z-v01.nc</File_Name>
  <File_Release_Date>20070828T011626Z</File_Release_Date>
  <File_Version>1.0</File_Version>
  <Related_URL>
    <URL>ftp://gp16.ssd.nesdis.noaa.gov/pub/goessst/L2P/20070828-GOES11-OSDPD-L2P-GOES11_North_0000Z-v01.nc.gz</URL>
    <Description>FTP directory containing GOES Level2p data</Description>
  </Related_URL>
  <Temporal_Coverage>
    <Start_Date>20070828T000000Z</Start_Date>
    <Stop_Date>20070828T001000Z</Stop_Date>
  </Temporal_Coverage>
  <Spatial_Coverage>
    <Southernmost_Latitude>  0.096</Southernmost_Latitude>
    <Northernmost_Latitude>76.204</Northernmost_Latitude>
    <Westernmost_Longitude>146.349</Westernmost_Longitude>
    <Easternmost_Longitude>-58.552</Easternmost_Longitude>
  </Spatial_Coverage>
  <Personnel>
    <Role>Technical Contact</Role>
    <First_Name>Eileen</First_Name>
    <Last_Name>Maturi</Last_Name>
    <Email>Eileen.Maturi@noaa.gov</Email>
    <Phone>301-763-8102 x172</Phone>
    <Fax>301-763-8572</Fax>
    <Address>NOAA/NESDIS/STAR/SOCD, 5200 Auth Road, WWB, RM 601 Camp Springs, MD 20746, USA</Address>
  </Personnel>
  <Metadata_History>
    <FR_File_Version>1.0</FR_File_Version>
    <FR_Creation_Date>20070828T011626Z</FR_Creation_Date>
    <FR_Last_Revision_Date>20070828T011626Z</FR_Last_Revision_Date>
    <FR_Revision_History>File created on 20070828T011626Z</FR_Revision_History>
  </Metadata_History>
  <File_Compression>gzip</File_Compression>
</MMR_FR>
